Category,Score,MaxScore,Strengths,Weaknesses,Evidence
Structure and Narrative Design,19,20,"Strong myth-break opening, four-scale map, national-context bridge, Patch SLA climax, and trust-before-audit close.","Baseline version risks treating slides 6-7 as a middle lecture, or treating national strategy as a second topic, rather than one evidence bridge.","Slides 3, 4, 5, 6, 12, and 14 form a repeatable narrative spine."
Content Depth and Value,19,20,"Specific evidence chain, AI stack boundaries, Taiwan AI/CI resilience context, testing outputs, and Patch SLA decisions.",Baseline testing section can sound like a tool survey if not tied to findings and retest evidence; cross-sector examples can become scope creep if overexplained.,"FDA 524B verbs, FDA 2026 cybersecurity traceability, Taiwan national strategy, and financial resilience language are converted into artifacts and decisions."
Stage Rhythm and Time Control,14,15,28:30 content target with 1:30 buffer; Slide 10 recovery beat protects attention.,Baseline can run late if slides 6-7 or 11 expand.,"Slide-level seconds total 1710 and define cut markers at slide 7, slide 12, and slide 14."
Delivery Quality,14,15,Stage-language anchors are concise and credible.,Baseline wording can become explanatory instead of decision-oriented in regulatory and testing sections.,"Strong lines: `你賣的不是模型`, `法規要的是證據，不是口號`, `Cyber Safety is Patient Safety`, `沒有 decision，就沒有治理；沒有證據，就沒有信任`."
Visual Design,9,10,"Deck uses statement, full visual, contrast, diagram, and progressive-build layouts.",Baseline slides 6-7 require strict label control to avoid visual density.,"Memory slides 3, 5, 10, 12, and 14 are visually distinctive."
Stage Presence,9,10,Memory slides create obvious eye-contact and stillness moments.,Time pressure can reduce composure if Slide 11 expands.,"Slides 3, 10, 12, and 14 are built for stillness and direct address."
Audience Impact,10,10,The talk gives memorable phrases plus a concrete 30 / 60 / 90 evidence loop.,Baseline impact weakens if the final minute is rushed.,"Four-scale map, medical AI as an AI/critical-infrastructure continuity case, Patch SLA, and 30 / 60 / 90 roadmap provide post-session utility."
